{
  "schema_version": "enterprise-agent-system/inception-four-tier-policy-candidate/v1",
  "candidate_id": "INCEPTION-A4-FIXTURE-001",
  "dimensions": {
    "code": {
      "subject": "ed3c/example@0123456789abcdef0123456789abcdef01234567/tree/89abcdef0123456789abcdef0123456789abcdef",
      "version": "0123456789abcdef0123456789abcdef01234567",
      "content_digest": "sha256:aaaaaaaaaaaaaaaaaaaaaaaaaaaaaaaaaaaaaaaaaaaaaaaaaaaaaaaaaaaaaaaa",
      "terms_digest": "sha256:bbbbbbbbbbbbbbbbbbbbbbbbbbbbbbbbbbbbbbbbbbbbbbbbbbbbbbbbbbbbbbbb",
      "obligations": ["preserve notices"],
      "blockers": [],
      "expiry_trigger": "source or terms digest changes",
      "policy_state": "CANDIDATE",
      "human_review_owner": "ed3c",
      "human_review_subject": null
    },
    "model": {
      "subject": "fixture-provider/fixture-model",
      "version": "2026-08-fixture",
      "content_digest": "sha256:cccccccccccccccccccccccccccccccccccccccccccccccccccccccccccccccc",
      "terms_digest": "sha256:dddddddddddddddddddddddddddddddddddddddddddddddddddddddddddddddd",
      "obligations": ["review data-use and distillation terms"],
      "blockers": ["Human terms review absent"],
      "expiry_trigger": "provider terms or model version changes",
      "policy_state": "HUMAN_REVIEW_REQUIRED",
      "human_review_owner": "ed3c",
      "human_review_subject": null
    },
    "data": {
      "subject": "fixture-dataset",
      "version": "snapshot-001",
      "content_digest": "sha256:eeeeeeeeeeeeeeeeeeeeeeeeeeeeeeeeeeeeeeeeeeeeeeeeeeeeeeeeeeeeeeee",
      "terms_digest": "sha256:ffffffffffffffffffffffffffffffffffffffffffffffffffffffffffffffff",
      "obligations": ["preserve origin and attribution lineage"],
      "blockers": [],
      "expiry_trigger": "dataset snapshot or terms changes",
      "policy_state": "CANDIDATE",
      "human_review_owner": "ed3c",
      "human_review_subject": null
    },
    "trace": {
      "subject": "fixture-otel-flow",
      "version": "v1",
      "content_digest": "sha256:1111111111111111111111111111111111111111111111111111111111111111",
      "terms_digest": "sha256:2222222222222222222222222222222222222222222222222222222222222222",
      "obligations": ["sanitize before export", "enforce retention, RBAC, deletion and training-use policy"],
      "blockers": ["live leak canary absent"],
      "expiry_trigger": "collector exporter storage or policy changes",
      "policy_state": "HUMAN_REVIEW_REQUIRED",
      "human_review_owner": "ed3c",
      "human_review_subject": null
    }
  },
  "overall_state": "HUMAN_REVIEW_REQUIRED",
  "claims_not_proven": [
    "This fixture does not establish commercial clearance.",
    "This fixture does not establish zero leakage.",
    "No Human legal or security disposition exists."
  ]
}
